{
  "baseline_name": "qwen_vl_semantic_source",
  "baseline_run_id": "qwen3_vl_4b_semantic_only_v1",
  "decoding": {
    "max_new_tokens": 256,
    "seed": 42,
    "temperature": 0.0,
    "top_p": 1.0
  },
  "input_record_sha256": "0000000000000000000000000000000000000000000000000000000000000000",
  "model_id": "Qwen/Qwen3-VL-4B-Instruct",
  "model_revision": "REQUIRED_FIXED_REVISION",
  "object_id": 7,
  "parser_status": "parsed",
  "predicate_family": "support_contact",
  "predictions": [
    {
      "answer_is_visible": true,
      "predicate": "supported by",
      "rank": 1,
      "rationale_short": "subject appears on object",
      "semantic_score": 0.73
    }
  ],
  "prompt_version": "semantic_only_v1",
  "raw_response": "{\"answer_is_visible\": true, \"predictions\": [{\"predicate\": \"supported by\", \"confidence\": 0.73, \"rationale_short\": \"subject appears on object\"}]}",
  "record_id": "scan001::subgraph_a::obj_3->obj_7::support_contact",
  "scan_id": "scan001",
  "schema_version": "h001_qwen_vl_prediction_v2",
  "split": "held_out",
  "subgraph_id": "subgraph_a",
  "subject_id": 3,
  "warnings": []
}
